{
  "$schema": "./ddd-schema.json",
  "$id": "./ddd-kpi-employee-v1.0.0.json",
  "meta": {
    "id": "ddd-kpi-employee",
    "version": "1.0.0",
    "title": "DDD-KPI — KPI Documentation Framework (Employee Edition)",
    "description": "Framework สำหรับพนักงาน Ragnar ในการกำหนด KPI ประจำไตรมาสอย่างเป็นระบบ รับ Context บริษัท บทบาทงาน นโยบาย KPI และ KPI Company แล้ว generate Key Results, Key Activities, พร้อม spec สำหรับ Presentation ต้นและปลายไตรมาส",
    "language": "th/en bilingual — narrative sections in Thai, identifiers, field names, and metric names in English",
    "output_dir": "docs/",
    "domain": "Performance Management / KPI Setting",
    "applicable_when": "พนักงาน Ragnar ทุกระดับ (Operation และ Team Leader) ที่ต้องการกำหนด KPI ประจำไตรมาสอย่างเป็นระบบ สอดคล้องกับ KPI Company และนโยบาย KPI ขององค์กร",
    "generation_order": [
      "context_map",
      "role_profile",
      "kpi_charter",
      "key_results",
      "key_activities",
      "presentation_spec"
    ],
    "agent_instructions": {
      "role": "คุณคือ KPI Advisor ผู้เชี่ยวชาญด้าน Performance Management สำหรับ Ragnar ใช้ DDD-KPI framework อ่าน Input Context ทั้งหมดที่พนักงานให้มา (Company Context, KPI Policy, Job Description, Job Landscape, KPI Company ของไตรมาสนี้) แล้วสร้างเอกสาร KPI Planning ให้ครบชุดตาม generation_order เนื้อหาทุกชิ้นต้องสอดคล้องกันและอ้างอิงข้อมูลจาก upstream documents เสมอ ห้ามสร้าง KPI หรือ target ขึ้นมาเองโดยไม่มี basis จาก Input Context",
      "generation_order_strategy": "เริ่มจาก context_map เพื่อ map Company Strategy กับ KPI Company ของไตรมาส จากนั้น role_profile เพื่อสรุปบทบาทและ constraints จาก JD + Job Landscape ทั้งสองเป็น foundation ของ kpi_charter ที่กำหนด Objectives, weights, และ measurement method แล้วจึง generate key_results (SMART targets ต่อ Objective) และ key_activities (กิจกรรมต่อเดือน) presentation_spec generate ได้เมื่อมี KR และ KA ครบแล้ว เพราะต้องใช้ข้อมูลจริงจากทั้งสองมา populate slide",
      "content_language": "เนื้อหา narrative sections เขียนเป็นภาษาไทย identifiers, field names, column headers, metric names, และ code เขียนเป็นภาษาอังกฤษ ชื่อ KPI และ Key Result ให้มีทั้งภาษาไทยและอังกฤษ",
      "quality_gate": "ทุก KR ต้องเป็น SMART (Specific, Measurable, Achievable, Relevant, Time-bound) พร้อมตัวเลข target ชัดเจน ทุก KPI ต้องมี data_source ที่ verify ได้และ link ไปยัง KPI Company อย่างน้อย 1 ข้อ weight รวมทุก KPI ต้องได้ 100% เสมอ Key Activities ต้องแบ่งตาม Month 1, 2, 3 พร้อม owner และ deadline ทุก document ต้องอ้างอิง upstream documents ด้วย context จริง ไม่ใช่ template ว่าง",
      "domain_specific_notes": [
        "Input Context ที่พนักงานต้องให้มาก่อน generate: (1) Company Context — Goal, Vision, Mission, Strategic Theme, (2) KPI Policy — นโยบายการกำหนด KPI ขององค์กร, (3) Job Description ของพนักงานคนนี้, (4) Job Landscape ของแผนกที่พนักงานสังกัด, (5) KPI Company ของไตรมาสนี้ที่ได้รับจากผู้บริหาร",
        "KPI weight รวมกันต้องได้ 100% เสมอ ตรวจสอบก่อน generate key_results และ flag ถ้าไม่ตรง",
        "แต่ละไตรมาสมี 3 เดือน KEY_ACTIVITIES.md ต้องแบ่งกิจกรรมเป็น Month 1, 2, 3 อย่างชัดเจน และระบุ milestone ปลายแต่ละเดือน",
        "PRESENTATION_SPEC.md ต้องมีครบ 2 ส่วน: Q-Start (นำเสนอแผน KPI ต้นไตรมาส) และ Q-End (นำเสนอผลลัพธ์และบทเรียนปลายไตรมาส) ขาดอันใดอันหนึ่งไม่ได้"
      ]
    }
  },
  "phases": [
    {
      "id": "phase_context",
      "order": 1,
      "title": {
        "th": "Phase 1 · บริบทและการ Align",
        "en": "Phase 1 · Context & Alignment"
      },
      "description": {
        "th": "วิเคราะห์และเชื่อมโยง Input Context ทั้งหมด: Company Strategy → KPI Company → บทบาทพนักงาน สร้างฐานความเข้าใจร่วมก่อนออกแบบ KPI",
        "en": "Synthesize all Input Context: Company Strategy → Company KPI → Employee role. Builds the shared understanding foundation before KPI design."
      },
      "documents": [
        {
          "id": "context_map",
          "filename": "CONTEXT_MAP.md",
          "title": "Context Map — แผนที่บริบทองค์กรและไตรมาส",
          "description": {
            "th": "เชื่อมโยง Goal, Vision, Mission, Strategic Theme ขององค์กร กับ KPI Company ของไตรมาสนี้ และบทบาทของพนักงาน",
            "en": "Maps company strategy (Goal/Vision/Mission/Strategic Theme) to this quarter's Company KPI and employee role"
          },
          "priority": "P0",
          "depends_on": [],
          "output_format": {
            "type": "markdown",
            "suggested_headings": [
              "Company Strategy Summary",
              "KPI Company This Quarter",
              "Role-KPI Alignment Matrix",
              "Quarter Context"
            ]
          },
          "agent_hints": {
            "instruction": "อ่าน Company Context document (Goal, Vision, Mission, Strategic Theme) และ KPI Company ของไตรมาสนี้ที่พนักงานให้มา สร้าง mapping ชัดเจนว่า KPI Company ข้อไหน connect กับ Strategic Theme ใด และ role ของพนักงานนี้ relate กับ KPI Company ข้อใดบ้าง ใช้ตารางอธิบาย connection ระบุ quarter number และปีให้ชัดเจนใน header ห้ามเพิ่ม KPI Company ที่ไม่มีใน Input",
            "input_context": "Company Context document (Goal, Vision, Mission, Strategic Theme); KPI Company ของไตรมาสนี้ที่ผู้บริหารให้มา; ชื่อ quarter และปี (เช่น Q3/2026); ชื่อพนักงาน ตำแหน่ง และทีม",
            "estimated_length": "400-600 words + 2 tables",
            "validation": "ทุก KPI Company ต้องถูก map กับ Strategic Theme อย่างน้อย 1 ข้อ; ระบุ quarter และปีในทุก section; ระบุว่า role นี้ primarily contribute ต่อ KPI Company ข้อใด; ห้ามมี KPI Company ที่ไม่ได้มาจาก Input"
          },
          "sections": [
            {
              "id": "company_strategy_summary",
              "heading": "Company Strategy Summary",
              "description": {
                "th": "สรุป Goal, Vision, Mission, และ Strategic Themes ที่ relevant กับไตรมาสนี้",
                "en": "Summarize Goal, Vision, Mission, and Strategic Themes relevant to this quarter"
              },
              "refs": [],
              "items": [
                {
                  "text_th": "Company Goal: สรุปเป้าหมายระยะยาวขององค์กรในประโยคที่กระชับ ใช้เป็น north star ของ KPI ทั้งหมด",
                  "text_en": "Company Goal: concise long-term goal statement as the KPI north star"
                },
                {
                  "text_th": "Vision & Mission: สรุป Vision (อยากเป็นอะไร) และ Mission (ทำอะไรเพื่อใคร) ที่ให้ context การตัดสินใจด้าน KPI",
                  "text_en": "Vision & Mission: summarize what the company wants to be and how it serves its stakeholders"
                },
                {
                  "text_th": "Strategic Themes: รายการ Strategic Theme ทั้งหมดของไตรมาสนี้ พร้อม priority หรือ weight ถ้ามี",
                  "text_en": "Strategic Themes: all themes for this quarter with priority or weight if available"
                }
              ]
            },
            {
              "id": "kpi_company_this_quarter",
              "heading": "KPI Company This Quarter",
              "description": {
                "th": "รายการ KPI Company ของไตรมาสนี้ทั้งหมดที่ได้รับจากผู้บริหาร",
                "en": "Full list of Company KPIs for this quarter as received from management"
              },
              "refs": [],
              "items": [
                {
                  "text_th": "ตาราง KPI Company: KPI_ID | KPI Name (TH) | KPI Name (EN) | Target | Unit | Strategic Theme | Company Owner",
                  "text_en": "Company KPI table: KPI_ID | KPI Name (TH) | KPI Name (EN) | Target | Unit | Strategic Theme | Company Owner"
                },
                {
                  "text_th": "ระบุ KPI Company ที่ role นี้ต้อง contribute แบบ Primary (รับผิดชอบหลัก) และ Secondary (สนับสนุน)",
                  "text_en": "Identify KPIs this role contributes to as Primary (main owner) vs. Secondary (supporting)"
                }
              ]
            },
            {
              "id": "role_kpi_alignment",
              "heading": "Role-KPI Alignment Matrix",
              "description": {
                "th": "ตาราง mapping ว่า KPI Company ข้อใดเชื่อมโยงกับ role นี้อย่างไร",
                "en": "Matrix mapping Company KPIs to this role's contribution type"
              },
              "refs": [
                "role_profile"
              ],
              "items": [
                {
                  "text_th": "Alignment Matrix: Company KPI | Contribution Type (Primary / Secondary / None) | เหตุผลการ align กับ role นี้",
                  "text_en": "Alignment Matrix: Company KPI | Contribution Type (Primary / Secondary / None) | Alignment rationale"
                },
                {
                  "text_th": "Flag ถ้ามี KPI Company ที่ไม่มี role ใดรับผิดชอบ (gap ของการ coverage)",
                  "text_en": "Flag any Company KPI with no responsible role (coverage gap)"
                }
              ]
            },
            {
              "id": "quarter_context",
              "heading": "Quarter Context",
              "description": {
                "th": "ข้อมูลเชิง context ของไตรมาสนี้: ชื่อพนักงาน ทีม ตำแหน่ง ระดับ",
                "en": "Quarter metadata: employee name, team, position, level, date range"
              },
              "refs": [],
              "items": [
                {
                  "text_th": "Employee: ชื่อ-นามสกุล | ตำแหน่ง | ทีม | ระดับ (Team Leader / Operation)",
                  "text_en": "Employee: Full Name | Position | Team | Level (Team Leader / Operation)"
                },
                {
                  "text_th": "Quarter: Q_/20__ | วันเริ่มต้น | วันสิ้นสุด | รหัสไตรมาส (เช่น 2026-Q3)",
                  "text_en": "Quarter: Q_/20__ | Start Date | End Date | Quarter Code (e.g. 2026-Q3)"
                }
              ]
            }
          ]
        },
        {
          "id": "role_profile",
          "filename": "ROLE_PROFILE.md",
          "title": "Role Profile — โปรไฟล์บทบาทและความรับผิดชอบ",
          "description": {